     1|     1|     1|     1|     1|     1|     1|     1|     1|     1|     1|     1|     1|     1|     1|     1|     1|     1|     1|     1|     1|target_commit	mode	throughput	mean_ttft_ms	autotune_applied	last_tuned_eff_weight	status	description
2ab3ce201	fast	5.240437972606149	183765.31899549445	2	1.0	discard	treat the immediate post-bootstrap round as confirmation-only and keep the active weight until a later window reaffirms a switch
2ab3ce201	fast	5.328260455109086	180865.10256320526	2	0.0	discard	later rounds first restrict the source window to a fresh recent half when that half still carries enough insert pressure, then reuse the insert-budget suffix anchor
2ab3ce201	fast	5.142579324070691	187690.17801329633	2	0.1	discard	later-round objective breaks near-best score ties by lower replay churn (mamba/state evictions and full-token evictions) while favoring smaller moves from the active weight
2ab3ce201	fast	5.363037483179596	181622.1474065404	1	0.5	discard	stage post-bootstrap control by giving the immediate follow-up round a 25 percent larger evidence budget before starting later tuning
2ab3ce201	fast	5.401911191696466	180133.24805315473	2	0.1	discard	later rounds anchor the window on the latest insert-bearing region and trim long dead tails while preserving the insert-budget bootstrap suffix
2ab3ce201	fast	5.137737605356718	187848.98638896903	1	2.0	discard	later-round objective picks among near-best weights by per-request support mass over the active weight while preserving the insert-budget bootstrap anchor
2ab3ce201	fast	5.139685523039757	187652.4641264791	1	2.0	discard	delay the immediate post-bootstrap follow-up round until it sees at least a few insert-bearing requests or a 50 percent larger evidence budget
